{
  "contract": "melo.creative-master",
  "contractVersion": "1.0.0",
  "id": "master.demo",
  "ruleProfile": "block-placement-classic-v1",
  "board": {
    "rows": 8,
    "cols": 8
  },
  "replay": {
    "takeId": "take.demo",
    "semanticHash": "sha256:semantic-demo",
    "frameHash": "sha256:frame-demo",
    "fps": 30,
    "totalFrames": 450
  },
  "layoutProfileRef": {
    "id": "layout.vertical",
    "version": "1.0.0",
    "kind": "ui-theme",
    "contentHash": "sha256:2559676af3b4bbcbb4613aec27631c4af621779f592b8d77b07166bed266e3cc"
  },
  "cameraProfileRef": {
    "id": "camera.fixed",
    "version": "1.0.0",
    "kind": "camera-profile",
    "contentHash": "sha256:8eefff79c15dafc44a3bbfb7799c4204f9865925a2813f6e72b8cfa4dd3f158c"
  },
  "baseOutput": {
    "width": 1080,
    "height": 1920,
    "fps": 30,
    "quality": "cinematic"
  }
}
